{
  "air_version": "1.1",
  "snapshot_timestamp": "2026-04-12T00:00:00Z",
  "active_frameworks": [
    {
      "name": "HIPAA",
      "version": "2013 Omnibus Rule",
      "status": "active",
      "effective_from": "2025-01-01T00:00:00Z",
      "policy_version": "hipaa-omnibus-hca-2025"
    },
    {
      "name": "SOC2",
      "version": "Type II",
      "status": "active",
      "effective_from": "2025-06-01T00:00:00Z"
    }
  ],
  "policy_snapshots": [
    {
      "policy_id": "prior-auth-governance-v2",
      "version": "2.1.0",
      "active_from": "2026-01-15T00:00:00Z",
      "hash": "sha256:d4e5f6a1b2c3"
    }
  ],
  "data_classifications": [
    {
      "classification": "PHI",
      "access_level": "read",
      "authorized_from": "2025-01-01T00:00:00Z"
    }
  ],
  "audit_retention_policy": {
    "retention_days": 2555,
    "legal_hold": false
  }
}
