{
  "air_version": "1.1",
  "snapshot_timestamp": "2026-04-12T00:00:00Z",
  "active_frameworks": [
    {
      "name": "PCI-DSS",
      "version": "4.0",
      "status": "active",
      "effective_from": "2025-01-15T00:00:00Z",
      "policy_version": "pci-v4.0-acme-2025-01",
      "notes": "Full compliance achieved; annual audit passed 2025-12-10"
    },
    {
      "name": "SOC2",
      "version": "Type II",
      "status": "active",
      "effective_from": "2025-03-01T00:00:00Z",
      "policy_version": "soc2-t2-acme-2025"
    },
    {
      "name": "NIST-AI-RMF",
      "version": "1.0",
      "status": "pending",
      "effective_from": "2026-07-01T00:00:00Z",
      "notes": "Adoption scheduled for Q3 2026"
    }
  ],
  "policy_snapshots": [
    {
      "policy_id": "fraud-detection-governance-v3",
      "version": "3.2.1",
      "active_from": "2026-02-01T00:00:00Z",
      "hash": "sha256:a1b2c3d4e5f6"
    },
    {
      "policy_id": "escalation-rules-financial",
      "version": "1.8.0",
      "active_from": "2025-11-15T00:00:00Z",
      "hash": "sha256:f6e5d4c3b2a1"
    }
  ],
  "data_classifications": [
    {
      "classification": "PCI",
      "access_level": "read",
      "authorized_from": "2025-01-15T00:00:00Z"
    },
    {
      "classification": "PII",
      "access_level": "read",
      "authorized_from": "2025-01-15T00:00:00Z"
    }
  ],
  "audit_retention_policy": {
    "retention_days": 2555,
    "legal_hold": false
  }
}
